Title,Rated,Released,Runtime,Genre,Director,Writer,Actors,Awards,Metascore,imdbRating,imdbVotes,imdbID,BoxOffice,Production,Tomatoscore
Oklahoma!,G,06 Sep 1956,145 min,"Comedy, Drama, Musical, Romance, Western",Fred Zinnemann,"Sonya Levien (screen play), William Ludwig (screen play), Richard Rodgers (adapted from Rodgers and Hammerstein's musical play), Oscar Hammerstein II (adapted from Rodgers and Hammerstein's musical play), Lynn Riggs (based upon a dramatic play by)","Gordon MacRae, Gloria Grahame, Gene Nelson, Charlotte Greenwood",Won 2 Oscars. Another 1 win & 4 nominations.,N/A,7.0,"10,482",tt0048445,N/A,ByExperience,92%
Chaplin,PG-13,08 Jan 1993,143 min,"Biography, Comedy, Drama",Richard Attenborough,"David Robinson (book), Charles Chaplin (book), Diana Hawkins (story), William Boyd (screenplay), Bryan Forbes (screenplay), William Goldman (screenplay)","Robert Downey Jr., Geraldine Chaplin, Paul Rhys, John Thaw",Nominated for 3 Oscars. Another 3 wins & 16 nominations.,47,7.6,"50,530",tt0103939,N/A,Columbia TriStar,60%
The Miracle Worker,Not Rated,28 Jul 1962,106 min,"Biography, Drama",Arthur Penn,"William Gibson (screenplay), William Gibson (based upon the stage play by)","Anne Bancroft, Victor Jory, Inga Swenson, Andrew Prine",Won 2 Oscars. Another 9 wins & 11 nominations.,83,8.1,"14,658",tt0056241,N/A,MGM Home Entertainment,100%
Babylon 5: In the Beginning,Unrated,04 Jan 1998,94 min,"Action, Adventure, Drama, Sci-Fi",Michael Vejar,"J. Michael Straczynski (creator), J. Michael Straczynski","Bruce Boxleitner, Mira Furlan, Richard Biggs, Andreas Katsulas",N/A,N/A,7.7,"6,951",tt0120711,N/A,Babylonian Productions,NA
The Wages of Fear,Not Rated,16 Feb 1955,131 min,"Adventure, Drama, Thriller",Henri-Georges Clouzot,"Georges Arnaud (novel), Henri-Georges Clouzot (adaptation), Jérôme Géronimi (adaptation)","Yves Montand, Charles Vanel, Folco Lulli, Peter van Eyck",Won 1 BAFTA Film Award. Another 5 wins.,N/A,8.1,"49,364",tt0046268,N/A,Janus Films,100%
Pat and Mike,Not Rated,13 Jun 1952,95 min,"Comedy, Romance, Sport",George Cukor,"Ruth Gordon, Garson Kanin","Spencer Tracy, Katharine Hepburn, Aldo Ray, William Ching",Nominated for 1 Oscar. Another 4 nominations.,N/A,7.0,"4,759",tt0045012,N/A,MGM Home Entertainment,90%
Cat People,Not Rated,25 Dec 1942,73 min,"Fantasy, Horror, Thriller",Jacques Tourneur,DeWitt Bodeen,"Simone Simon, Kent Smith, Tom Conway, Jane Randolph",1 win & 2 nominations.,N/A,7.3,"17,941",tt0034587,N/A,RKO Pictures,93%
Camelot,G,25 Oct 1967,179 min,"Adventure, Fantasy, Musical, Romance",Joshua Logan,"Alan Jay Lerner (based on the play ""Camelot"" book by), T.H. White (novel), Alan Jay Lerner (screenplay)","Richard Harris, Vanessa Redgrave, Franco Nero, David Hemmings",Won 3 Oscars. Another 4 wins & 6 nominations.,70,6.7,"5,498",tt0061439,N/A,Warner Home Video,44%
The Postman Always Rings Twice,Not Rated,14 Oct 1946,113 min,"Crime, Drama, Film-Noir, Mystery, Romance, Thriller",Tay Garnett,"Harry Ruskin (screen play), Niven Busch (screen play), James M. Cain (based on the novel by)","Lana Turner, John Garfield, Cecil Kellaway, Hume Cronyn",N/A,N/A,7.5,"17,155",tt0038854,N/A,MGM,92%
Throne of Blood,Not Rated,22 Nov 1961,110 min,"Drama, History",Akira Kurosawa,"Hideo Oguni (screenplay), Shinobu Hashimoto (screenplay), Ryûzô Kikushima (screenplay), Akira Kurosawa (screenplay)","Toshirô Mifune, Isuzu Yamada, Takashi Shimura, Akira Kubo",3 wins & 1 nomination.,N/A,8.1,"40,767",tt0050613,N/A,Media Home Entertainment,98%
September 11,Unrated,11 Sep 2002,134 min,Drama,"Youssef Chahine, Amos Gitai, Shôhei Imamura, Alejandro G. Iñárritu, Claude Lelouch, Ken Loach, Samira Makhmalbaf, Mira Nair, Idrissa Ouedraogo, Sean Penn, Danis Tanovic","Alain Brigand (original idea), Youssef Chahine (segment), Sabrina Dhawan (segment), Amos Gitai (segment), Alejandro G. Iñárritu (segment), Paul Laverty (segment), Claude Lelouch (adaptation), Claude Lelouch (dialogue), Claude Lelouch, Ken Loach (segment), Samira Makhmalbaf (segment), Idrissa Ouedraogo (segment), Sean Penn (segment), Marie-Jose Sanselme (segment), Danis Tanovic (segment), Daisuke Tengan (segment), Pierre Uytterhoeven (adaptation), Pierre Uytterhoeven (dialogue), Vladimir Vega (segment)","Maryam Karimi, Mohamad Dolati, Agelem Habibi, Esmat Vahedi",3 wins & 1 nomination.,61,6.9,"5,245",tt0328802,N/A,Empire Pictures,78%
Another Thin Man,Passed,17 Nov 1939,103 min,"Comedy, Crime, Mystery, Romance",W.S. Van Dyke,"Frances Goodrich (screen play), Albert Hackett (screen play), Dashiell Hammett (based on an original story by)","William Powell, Myrna Loy, Virginia Grey, Otto Kruger",N/A,N/A,7.5,"5,932",tt0031047,N/A,MGM Home Entertainment,81%
The Thin Man Goes Home,Approved,01 Jan 1945,100 min,"Comedy, Crime, Mystery, Romance",Richard Thorpe,"Robert Riskin (screen play), Dwight Taylor (screen play), Robert Riskin (from an original story by), Harry Kurnitz (from an original story by), Dashiell Hammett (based on the characters created by)","William Powell, Myrna Loy, Lucile Watson, Gloria DeHaven",N/A,N/A,7.4,"4,517",tt0037365,N/A,MGM (Metro-Goldwyn-Mayer),60%
Shadow of the Thin Man,Passed,01 Nov 1941,97 min,"Comedy, Crime, Mystery",W.S. Van Dyke,"Irving Brecher (screen play), Harry Kurnitz (screen play), Harry Kurnitz (from a story by), Dashiell Hammett (based upon characters created by)","William Powell, Myrna Loy, Barry Nelson, Donna Reed",N/A,N/A,7.3,"4,907",tt0034172,N/A,MGM,83%
After the Thin Man,Passed,25 Dec 1936,112 min,"Comedy, Crime, Mystery",W.S. Van Dyke,"Frances Goodrich (screen play), Albert Hackett (screen play), Dashiell Hammett (from the story by)","William Powell, Myrna Loy, James Stewart, Elissa Landi",N/A,N/A,7.7,"8,606",tt0027260,N/A,MGM Home Entertainment,100%
Song of the Thin Man,Not Rated,01 Sep 1947,86 min,"Comedy, Crime, Musical, Mystery",Edward Buzzell,"Steve Fisher (screen play), Nat Perrin (screen play), James O'Hanlon (additional dialogue), Harry Crane (additional dialogue), Stanley Roberts (story), Dashiell Hammett (based on the characters created by)","William Powell, Myrna Loy, Keenan Wynn, Dean Stockwell",N/A,N/A,7.1,"4,085",tt0039853,N/A,MGM Home Entertainment,80%
Dark Days,Not Rated,09 Mar 2001,82 min,Documentary,Marc Singer,N/A,Marc Singer,7 wins & 6 nominations.,75,7.8,"6,086",tt0235327,N/A,Picture Farm,94%
Zelig,PG,25 Aug 1983,79 min,Comedy,Woody Allen,Woody Allen,"Woody Allen, Mia Farrow, Patrick Horgan, John Buckwalter",Nominated for 2 Oscars. Another 6 wins & 14 nominations.,N/A,7.7,"37,660",tt0086637,N/A,Warner Home Video,100%
Infernal Affairs,R,12 Dec 2002,101 min,"Crime, Drama, Mystery, Thriller","Andrew Lau, Alan Mak","Alan Mak, Felix Chong","Andy Lau, Tony Chiu-Wai Leung, Anthony Chau-Sang Wong, Eric Tsang",23 wins & 24 nominations.,75,8.1,"112,340",tt0338564,N/A,Miramax,94%
Broadway Danny Rose,PG,27 Jan 1984,84 min,Comedy,Woody Allen,Woody Allen,"Woody Allen, Mia Farrow, Nick Apollo Forte, Sandy Baron",Nominated for 2 Oscars. Another 3 wins & 2 nominations.,80,7.4,"22,354",tt0087003,N/A,Vestron Video,100%
The Weather Underground,Unrated,13 Nov 2003,92 min,"Documentary, History, War","Sam Green, Bill Siegel(co-director)",N/A,"Lili Taylor, Pamela Z, Jim Lange, Evan White",Nominated for 1 Oscar. Another 4 wins & 3 nominations.,77,7.5,"3,313",tt0343168,N/A,Indican Pictures,91%
Dark Water,PG-13,19 Jan 2002,101 min,"Drama, Horror, Mystery, Thriller",Hideo Nakata,"Kôji Suzuki (novel), Ken'ichi Suzuki (screenplay), Yoshihiro Nakamura (screenplay)","Hitomi Kuroki, Rio Kanno, Mirei Oguchi, Asami Mizukawa",6 wins & 1 nomination.,N/A,6.7,"28,269",tt0308379,N/A,Toho Company Ltd,80%
Bad Day at Black Rock,Not Rated,15 May 1955,81 min,"Crime, Drama, Mystery, Thriller, Western",John Sturges,"Millard Kaufman (screen play), Don McGuire (adaptation), Howard Breslin (based on a story by)","Spencer Tracy, Robert Ryan, Anne Francis, Dean Jagger",Nominated for 3 Oscars. Another 3 wins & 5 nominations.,N/A,7.8,"17,426",tt0047849,N/A,MGM Home Entertainment,97%
Lust for Life,Approved,15 Sep 1956,122 min,"Biography, Drama","Vincente Minnelli, George Cukor(co-director)","Norman Corwin (screen play), Irving Stone (based on the novel by)","Kirk Douglas, Anthony Quinn, James Donald, Pamela Brown",Won 1 Oscar. Another 3 wins & 6 nominations.,N/A,7.4,"9,502",tt0049456,N/A,MGM,100%
Captain Blood,Passed,28 Dec 1935,119 min,"Action, Adventure",Michael Curtiz,"Rafael Sabatini (by), Casey Robinson (screen play)","Errol Flynn, Olivia de Havilland, Lionel Atwill, Basil Rathbone",N/A,N/A,7.7,"12,033",tt0026174,N/A,Twentieth Century Fox Home Entertainment,100%
Anne of the Thousand Days,PG,18 Dec 1969,145 min,"Biography, Drama, History",Charles Jarrott,"Bridget Boland (screenplay), John Hale (screenplay), Richard Sokolove (adaptation), Maxwell Anderson (play)","Richard Burton, Geneviève Bujold, Irene Papas, Anthony Quayle",Won 1 Oscar. Another 5 wins & 16 nominations.,N/A,7.5,"6,174",tt0064030,N/A,Universal Pictures,38%
The Day of the Jackal,PG,30 Jul 1973,143 min,"Crime, Drama, Thriller",Fred Zinnemann,"Frederick Forsyth (book), Kenneth Ross (screenplay)","Edward Fox, Terence Alexander, Michel Auclair, Alan Badel",Nominated for 1 Oscar. Another 1 win & 10 nominations.,80,7.8,"35,006",tt0069947,N/A,Universal Pictures,91%
The Maltese Falcon,Passed,13 Jun 1931,80 min,"Crime, Drama, Film-Noir, Mystery",Roy Del Ruth,"Dashiell Hammett (based on the novel by), Maude Fulton (screen play & dialogue), Brown Holmes (screen play & dialogue)","Bebe Daniels, Ricardo Cortez, Dudley Digges, Una Merkel",N/A,N/A,7.3,"2,531",tt0022111,N/A,WARNER BROTHERS PICTURES,71%
Safety Last!,Not Rated,01 Apr 1923,74 min,"Action, Comedy, Thriller","Fred C. Newmeyer, Sam Taylor","Hal Roach (story), Sam Taylor (story), Tim Whelan (story), H.M. Walker (titles)","Harold Lloyd, Mildred Davis, Bill Strother, Noah Young",1 win & 1 nomination.,N/A,8.1,"16,611",tt0014429,N/A,Criterion Collection,97%
Purple Rain,R,27 Jul 1984,111 min,"Drama, Music, Musical, Romance",Albert Magnoli,"Albert Magnoli, William Blinn","Prince, Apollonia Kotero, Morris Day, Olga Karlatos",Won 1 Oscar. Another 4 wins & 4 nominations.,55,6.6,"17,898",tt0087957,N/A,Warner Home Video,68%
College,Not Rated,01 Nov 1927,66 min,"Comedy, Drama, Sport","James W. Horne, Buster Keaton","Carl Harbaugh (story), Bryan Foy (story)","Buster Keaton, Anne Cornwall, Flora Bramley, Harold Goodwin",1 nomination.,N/A,7.1,"3,993",tt0017765,N/A,United Artists,89%
Make Way for Tomorrow,Passed,07 Oct 1937,91 min,"Comedy, Drama, Romance",Leo McCarey,"Viña Delmar (screen play), Josephine Lawrence (based on a novel by), Helen Leary (play), Nolan Leary (play)","Beulah Bondi, Victor Moore, Fay Bainter, Thomas Mitchell",2 wins.,N/A,8.2,"6,567",tt0029192,N/A,Paramount Pictures,100%
The Caine Mutiny,Not Rated,24 Jun 1954,124 min,"Drama, War",Edward Dmytryk,"Stanley Roberts (screen play), Michael Blankfort (additional dialogue), Herman Wouk (based upon the Pulitzer Prize winning novel by)","Humphrey Bogart, José Ferrer, Van Johnson, Fred MacMurray",Nominated for 7 Oscars. Another 6 nominations.,63,7.7,"23,055",tt0046816,N/A,Sony Pictures Home Entertainment,92%
Black Narcissus,Not Rated,01 Dec 1947,101 min,Drama,"Michael Powell, Emeric Pressburger","Rumer Godden (adapted from the novel by), Michael Powell, Emeric Pressburger","Deborah Kerr, Flora Robson, Jenny Laird, Judith Furse",Won 2 Oscars. Another 3 wins & 1 nomination.,N/A,7.9,"19,622",tt0039192,N/A,Universal International Pictur,100%
Oliver Twist,Not Rated,30 Jul 1951,105 min,Drama,David Lean,"Charles Dickens (by), David Lean (screen play), Stanley Haynes (screen play)","Robert Newton, Alec Guinness, Kay Walsh, Francis L. Sullivan",Nominated for 1 BAFTA Film Award. Another 1 win & 1 nomination.,N/A,7.8,"10,448",tt0040662,N/A,United Artists,100%
Shrek 2,PG,19 May 2004,93 min,"Animation, Adventure, Comedy, Family, Fantasy, Romance","Andrew Adamson, Kelly Asbury, Conrad Vernon","William Steig (based upon the book by), Andrew Adamson (story by), Andrew Adamson (screenplay by), Joe Stillman (screenplay by), J. David Stem (screenplay by), David N. Weiss (screenplay by), Cody Cameron (additional dialogue), Walt Dohrn (additional dialogue), Chris Miller (additional dialogue), David P. Smith (additional dialogue), Conrad Vernon (additional dialogue)","Mike Myers, Eddie Murphy, Cameron Diaz, Julie Andrews",Nominated for 2 Oscars. Another 18 wins & 50 nominations.,75,7.2,"389,672",tt0298148,"$436,471,036",Dreamworks,89%
Saved!,PG-13,11 Jun 2004,92 min,"Comedy, Drama",Brian Dannelly,"Brian Dannelly, Michael Urban","Jena Malone, Mandy Moore, Macaulay Culkin, Patrick Fugit",1 win & 6 nominations.,62,6.7,"43,318",tt0332375,"$8,786,715",MGM,61%
Harry Potter and the Prisoner of Azkaban,PG,04 Jun 2004,142 min,"Adventure, Family, Fantasy, Mystery",Alfonso Cuarón,"J.K. Rowling (novel), Steve Kloves (screenplay)","Daniel Radcliffe, Richard Griffiths, Pam Ferris, Fiona Shaw",Nominated for 2 Oscars. Another 14 wins & 45 nominations.,82,7.9,"499,491",tt0304141,"$249,358,727",Warner Bros. Pictures,90%
The Hunting of the President,TV-14,23 Jan 2004,90 min,Documentary,"Nickolas Perry, Harry Thomason","Joe Conason (book), Gene Lyons (book), Nickolas Perry (screenplay), Harry Thomason (screenplay)","Morgan Freeman, Jonathan Alter, Steve Barnes, Paul Begala",1 nomination.,53,7.0,880,tt0391225,N/A,Regent Releasing,74%
Napoleon Dynamite,PG,27 Aug 2004,96 min,Comedy,Jared Hess,"Jared Hess, Jerusha Hess","Jon Heder, Jon Gries, Aaron Ruell, Efren Ramirez",10 wins & 22 nominations.,64,6.9,"186,973",tt0374900,"$44,478,018",Fox Searchlight Pictures,71%
Hello Again,PG,06 Nov 1987,96 min,"Comedy, Drama, Fantasy, Romance",Frank Perry,Susan Isaacs,"Shelley Long, Judith Ivey, Gabriel Byrne, Corbin Bernsen",1 nomination.,N/A,5.2,"2,790",tt0093175,N/A,Touchstone Pictures,11%
The Divorcee,Passed,19 Apr 1930,84 min,"Romance, Drama",Robert Z. Leonard,"Ursula Parrott (based on a novel by), Nick Grinde (treatment), Zelda Sears (treatment), John Meehan (continuity and dialogue)","Norma Shearer, Chester Morris, Conrad Nagel, Robert Montgomery",Won 1 Oscar. Another 3 nominations.,N/A,6.8,"2,499",tt0020827,N/A,MGM,75%
Sands of Iwo Jima,Approved,01 Mar 1950,100 min,"Action, Drama, Romance, War",Allan Dwan,"Harry Brown (screenplay), James Edward Grant (screenplay), Harry Brown (story)","John Wayne, John Agar, Adele Mara, Forrest Tucker",Nominated for 4 Oscars. Another 1 win.,N/A,7.2,"8,735",tt0041841,N/A,Republic Pictures Home Video,100%
Johnny Belinda,Unrated,14 Sep 1948,102 min,Drama,Jean Negulesco,"Irma von Cube (screenplay), Allen Vincent (screenplay), Elmer Harris (from the stage play by)","Jane Wyman, Lew Ayres, Charles Bickford, Agnes Moorehead",Won 1 Oscar. Another 4 wins & 13 nominations.,N/A,7.8,"3,863",tt0040495,N/A,Warner Bros. Pictures,89%
Super Size Me,PG,11 Jun 2004,100 min,"Documentary, Comedy, Drama",Morgan Spurlock,Morgan Spurlock,"Chemeeka Walker, Dania Abu-Rmaileh, Amanda Kearsan, Christian Baucher",Nominated for 1 Oscar. Another 7 wins & 11 nominations.,73,7.2,"96,742",tt0390521,N/A,N/A,73/100
La Jetée,Not Rated,16 Feb 1962,28 min,"Short, Drama, Romance, Sci-Fi",Chris Marker,N/A,"Jean Négroni, Hélène Chatelain, Davos Hanich, Jacques Ledoux",2 wins.,N/A,8.3,"26,916",tt0056119,N/A,Criterion Collection,92%
Freaks,Not Rated,20 Feb 1932,64 min,"Drama, Horror",Tod Browning,"Clarence Aaron 'Tod' Robbins (suggested by story: ""Spurs""), Willis Goldbeck (screenplay), Leon Gordon (screenplay)","Wallace Ford, Leila Hyams, Olga Baclanova, Roscoe Ates",1 win & 1 nomination.,80,7.9,"39,211",tt0022913,N/A,MGM,94%
Dear Frankie,PG-13,15 Apr 2005,105 min,"Drama, Romance",Shona Auerbach,Andrea Gibb (screenplay),"Emily Mortimer, Jack McElhone, Mary Riggans, Sharon Small",8 wins & 8 nominations.,63,7.7,"20,545",tt0377752,N/A,Miramax Films,81%
The Notebook,PG-13,25 Jun 2004,123 min,"Drama, Romance",Nick Cassavetes,"Jeremy Leven (screenplay), Jan Sardi (adaptation), Nicholas Sparks (novel)","Tim Ivey, Gena Rowlands, Starletta DuPois, James Garner",12 wins & 10 nominations.,53,7.8,"485,575",tt0332280,"$81,000,000",New Line Cinema,53%
Tokyo Godfathers,PG-13,08 Nov 2003,92 min,"Animation, Adventure, Comedy, Drama","Satoshi Kon, Shôgo Furuya(co-director)","Satoshi Kon (screenplay), Satoshi Kon (story), Keiko Nobumoto (screenplay)","Tôru Emori, Aya Okamoto, Yoshiaki Umegaki, Shôzô Îzuka",8 wins & 1 nomination.,73,7.8,"27,123",tt0388473,N/A,Sony Pictures,90%
Our Hospitality,Not Rated,19 Nov 1923,65 min,"Comedy, Romance, Thriller","John G. Blystone, Buster Keaton","Jean C. Havez (story), Clyde Bruckman (story), Joseph A. Mitchell (story)","Buster Keaton, Natalie Talmadge, Joe Roberts, Francis X. Bushman Jr.",1 nomination.,N/A,7.8,"9,309",tt0014341,N/A,MGM,96%
Fahrenheit 9/11,R,25 Jun 2004,122 min,"Documentary, Drama, War",Michael Moore,Michael Moore,"Ben Affleck, Stevie Wonder, George W. Bush, James Baker III",29 wins & 16 nominations.,67,7.5,"123,084",tt0361596,"$119,078,393",Lions Gate,82%
Spider-Man 2,PG-13,30 Jun 2004,127 min,"Action, Adventure, Sci-Fi",Sam Raimi,"Stan Lee (comic book), Steve Ditko (comic book), Alfred Gough (screen story), Miles Millar (screen story), Michael Chabon (screen story), Alvin Sargent (screenplay)","Tobey Maguire, Kirsten Dunst, James Franco, Alfred Molina",Won 1 Oscar. Another 23 wins & 59 nominations.,83,7.3,"511,787",tt0316654,"$373,377,893",Sony Pictures,93%
Before Sunset,R,30 Jul 2004,80 min,"Drama, Romance",Richard Linklater,"Richard Linklater (screenplay), Julie Delpy (screenplay), Ethan Hawke (screenplay), Richard Linklater (story), Kim Krizan (story), Richard Linklater (characters), Kim Krizan (characters)","Ethan Hawke, Julie Delpy, Vernon Dobtcheff, Louise Lemoine Torrès",Nominated for 1 Oscar. Another 9 wins & 30 nominations.,90,8.0,"214,086",tt0381681,"$5,600,000",Warner Independent Pictures,95%
Anchorman: The Legend of Ron Burgundy,PG-13,09 Jul 2004,94 min,Comedy,Adam McKay,"Will Ferrell, Adam McKay","Will Ferrell, Christina Applegate, Paul Rudd, Steve Carell",1 win & 13 nominations.,63,7.2,"313,536",tt0357413,"$84,136,909",Dreamworks,66%
Maria Full of Grace,R,06 Aug 2004,101 min,"Crime, Drama",Joshua Marston,Joshua Marston,"Catalina Sandino Moreno, Virgina Ariza, Yenny Paola Vega, Rodrigo Sánchez Borhorquez",Nominated for 1 Oscar. Another 41 wins & 33 nominations.,87,7.4,"33,002",tt0390221,"$6,517,198",New Line Cinema,97%
The Bachelor and the Bobby-Soxer,Approved,01 Sep 1947,95 min,"Comedy, Romance",Irving Reis,Sidney Sheldon (original story and screen play),"Cary Grant, Myrna Loy, Shirley Temple, Rudy Vallee",N/A,N/A,7.3,"7,318",tt0039169,N/A,Turner Home Entertainment,75%
Night and Day,Approved,03 Aug 1946,128 min,"Biography, Drama, Musical",Michael Curtiz,"Charles Hoffman (screen play), Leo Townsend (screen play), William Bowers (screen play), Jack Moffitt (adaptation)","Cary Grant, Alexis Smith, Monty Woolley, Ginny Simms",N/A,N/A,6.2,"2,428",tt0038776,N/A,Warner Bros. Pictures,NA
The Prime of Miss Jean Brodie,PG,25 Feb 1969,116 min,"Drama, Romance",Ronald Neame,"Muriel Spark (adapted from the novel by), Jay Presson Allen (based on the play by), Jay Presson Allen (screenplay)","Maggie Smith, Robert Stephens, Pamela Franklin, Gordon Jackson",Won 1 Oscar. Another 5 wins & 10 nominations.,N/A,7.6,"7,951",tt0064840,N/A,20th Century Fox Film Corporation,83%
The Village,PG-13,30 Jul 2004,108 min,"Drama, Mystery, Thriller",M. Night Shyamalan,M. Night Shyamalan,"Bryce Dallas Howard, Joaquin Phoenix, Adrien Brody, William Hurt",Nominated for 1 Oscar. Another 4 wins & 21 nominations.,44,6.5,"230,913",tt0368447,"$114,170,863",Buena Vista,43%
Garden State,R,20 Aug 2004,102 min,"Comedy, Drama, Romance",Zach Braff,Zach Braff,"Zach Braff, Kenneth Graymez, George C. Wolfe, Austin Lysy",13 wins & 38 nominations.,67,7.4,"202,298",tt0333766,"$26,706,668",Fox Searchlight,86%
A Funny Thing Happened on the Way to the Forum,Approved,16 Oct 1966,99 min,"Comedy, Musical",Richard Lester,"Melvin Frank (screenplay), Michael Pertwee (screenplay), Burt Shevelove (book), Larry Gelbart (book), Titus Maccius Plautus (based on the play by)","Zero Mostel, Phil Silvers, Buster Keaton, Michael Crawford",Won 1 Oscar. Another 1 nomination.,N/A,6.9,"7,897",tt0060438,N/A,Quandrangle,85%
Danny Deckchair,PG-13,31 Jul 2003,100 min,"Comedy, Romance",Jeff Balsmeyer,"Jeff Balsmeyer, Lizzie Bryant (additional dialogue), Tim Gooding (additional dialogue)","Rhys Ifans, Miranda Otto, Justine Clarke, Rhys Muldoon",2 nominations.,56,6.8,"4,585",tt0337960,N/A,Lions Gate Films,55%
Bill Cosby: Himself,PG,20 May 1983,105 min,"Documentary, Comedy",Bill Cosby,Bill Cosby,Bill Cosby,N/A,N/A,8.2,"3,317",tt0083652,N/A,Twentieth Century Fox Home Entertainment,83%
Shaun of the Dead,R,24 Sep 2004,99 min,"Comedy, Horror",Edgar Wright,"Simon Pegg, Edgar Wright","Simon Pegg, Kate Ashfield, Nick Frost, Lucy Davis",13 wins & 20 nominations.,76,7.9,"479,169",tt0365748,"$13,464,388",Focus Features,92%
"Come Back, Little Sheba",Approved,13 Feb 1953,99 min,"Drama, Romance",Daniel Mann,"Ketti Frings (screenplay), William Inge (original play)","Burt Lancaster, Shirley Booth, Terry Moore, Richard Jaeckel",Won 1 Oscar. Another 6 wins & 8 nominations.,N/A,7.5,"4,088",tt0044509,N/A,Paramount Pictures,86%
Murder on the Orient Express,PG,24 Nov 1974,128 min,"Crime, Drama, Mystery",Sidney Lumet,Paul Dehn (screenplay by),"Albert Finney, Lauren Bacall, Martin Balsam, Ingrid Bergman",Won 1 Oscar. Another 8 wins & 16 nominations.,63,7.3,"50,678",tt0071877,N/A,Paramount Home Video,91%
Mask,PG-13,22 Mar 1985,120 min,"Biography, Drama",Peter Bogdanovich,Anna Hamilton Phelan,"Cher, Sam Elliott, Eric Stoltz, Estelle Getty",Won 1 Oscar. Another 2 wins & 7 nominations.,73,7.2,"24,426",tt0089560,N/A,MCA Universal Home Video,93%
Primer,PG-13,27 May 2005,77 min,"Drama, Sci-Fi, Thriller",Shane Carruth,Shane Carruth,"Shane Carruth, David Sullivan, Casey Gooden, Anand Upadhyaya",3 wins & 7 nominations.,68,6.9,"91,252",tt0390384,"$392,420",ThinkFilm,72%
The Country Girl,Unrated,17 May 1955,104 min,"Drama, Music",George Seaton,"Clifford Odets (play), George Seaton (written for the screen by)","Bing Crosby, Grace Kelly, William Holden, Anthony Ross",Won 2 Oscars. Another 5 wins & 11 nominations.,N/A,7.3,"4,963",tt0046874,N/A,Paramount Pictures,86%
Tarnation,Unrated,10 Nov 2004,88 min,"Documentary, Biography",Jonathan Caouette,Jonathan Caouette,"Renee Leblanc, Jonathan Caouette, Adolph Davis, Rosemary Davis",9 wins & 12 nominations.,87,7.1,"6,142",tt0390538,"$417,541",Wellspring,92%
Being Julia,R,18 Feb 2005,104 min,"Comedy, Drama, Romance",István Szabó,"W. Somerset Maugham (novel), Ronald Harwood (screenplay)","Michael Gambon, Annette Bening, Leigh Lawson, Shaun Evans",Nominated for 1 Oscar. Another 8 wins & 18 nominations.,65,7.0,"11,630",tt0340012,"$7,652,647",Sony Pictures Classics,76%
Sideways,R,21 Jan 2005,127 min,"Comedy, Drama, Romance",Alexander Payne,"Rex Pickett (novel), Alexander Payne (screenplay), Jim Taylor (screenplay)","Paul Giamatti, Thomas Haden Church, Virginia Madsen, Sandra Oh",Won 1 Oscar. Another 122 wins & 87 nominations.,94,7.5,"171,355",tt0375063,"$71,444,367",Fox Searchlight Pictures,97%
The Machinist,R,03 Dec 2004,101 min,"Drama, Thriller",Brad Anderson,Scott Kosar,"Christian Bale, Jennifer Jason Leigh, Aitana Sánchez-Gijón, John Sharian",7 wins & 15 nominations.,61,7.7,"335,701",tt0361862,"$939,471",Paramount Classics,77%
Vera Drake,R,04 Feb 2005,125 min,"Crime, Drama",Mike Leigh,Mike Leigh,"Imelda Staunton, Richard Graham, Eddie Marsan, Anna Keaveney",Nominated for 3 Oscars. Another 40 wins & 40 nominations.,83,7.7,"22,520",tt0383694,"$3,627,889",New Line Cinema,92%
Saw,R,29 Oct 2004,103 min,"Horror, Mystery, Thriller",James Wan,"Leigh Whannell, James Wan (story), Leigh Whannell (story)","Leigh Whannell, Cary Elwes, Danny Glover, Ken Leung",8 wins & 10 nominations.,46,7.6,"357,439",tt0387564,"$55,100,000",Lions Gate Films,49%
Ray,PG-13,29 Oct 2004,152 min,"Biography, Drama, Music",Taylor Hackford,"Taylor Hackford (story), James L. White (story), James L. White (screenplay)","Jamie Foxx, Kerry Washington, Regina King, Clifton Powell",Won 2 Oscars. Another 52 wins & 54 nominations.,73,7.7,"129,444",tt0350258,"$75,000,000",Universal Pictures,80%
The Incredibles,PG,05 Nov 2004,115 min,"Animation, Action, Adventure, Family",Brad Bird,Brad Bird,"Craig T. Nelson, Holly Hunter, Samuel L. Jackson, Jason Lee",Won 2 Oscars. Another 65 wins & 55 nominations.,90,8.0,"617,169",tt0317705,N/A,N/A,90/100
Finding Neverland,PG,17 Dec 2004,106 min,"Biography, Drama, Family",Marc Forster,"Allan Knee (play), David Magee (screenplay)","Johnny Depp, Kate Winslet, Julie Christie, Radha Mitchell",Won 1 Oscar. Another 19 wins & 80 nominations.,67,7.7,"192,408",tt0308644,N/A,Miramax Films,82%
Guerrilla: The Taking of Patty Hearst,UNRATED,30 May 2005,89 min,"Documentary, Biography, History",Robert Stone,N/A,"Russ Little, Michael Bortin, Timothy Findley, Dan Grove",1 nomination.,75,7.3,427,tt0390299,,,89%
House of Flying Daggers,PG-13,14 Jan 2005,119 min,"Action, Adventure, Drama, Romance",Yimou Zhang,"Feng Li, Bin Wang, Yimou Zhang","Takeshi Kaneshiro, Andy Lau, Ziyi Zhang, Dandan Song",Nominated for 1 Oscar. Another 19 wins & 68 nominations.,89,7.5,"103,575",tt0385004,"$10,928,042",Sony Pictures Classics,88%
Love Me If You Dare,R,28 May 2004,93 min,"Comedy, Drama, Romance",Yann Samuell,Yann Samuell,"Guillaume Canet, Marion Cotillard, Thibault Verhaeghe, Joséphine Lebas-Joly",5 wins & 2 nominations.,45,7.6,"64,357",tt0364517,"$449,282",Paramount Classics,44%
Control Room,Not Rated,18 Jun 2004,84 min,Documentary,Jehane Noujaim,"Julia Bacha, Jehane Noujaim","Samir Khader, Josh Rushing, George W. Bush, Hassan Ibrahim",9 wins & 10 nominations.,79,7.8,"4,928",tt0391024,"$2,222,612",Magnolia Pictures,95%
